{
  "version": 1,
  "type": "workflowPackage",
  "activeWorkflowId": "wf_split_last_name",
  "workflows": [
    {
      "version": 2,
      "workflowId": "wf_split_last_name",
      "name": "Split last name",
      "steps": [
        {
          "id": "step_split_last_name",
          "type": "splitColumn",
          "columnId": "col_last_name",
          "delimiter": " ",
          "outputColumns": [
            {
              "columnId": "col_last_name_part_1",
              "displayName": "last_name_part_1"
            },
            {
              "columnId": "col_last_name_part_2",
              "displayName": "last_name_part_2"
            }
          ]
        }
      ]
    }
  ],
  "runOrderWorkflowIds": [
    "wf_split_last_name"
  ]
}
